{
  "$schema": "http://json-schema.org/draft-07/schema#",
  "$id": "https://stackbreak.launchready.cn/schemas/targets-v2.json",
  "title": "Stack Break Lab target registry v2",
  "description": "Single-document shape for probe/targets.json and probe/targets-community.json. Cross-file rules (id uniqueness across files, vendor existence, tier-specific fields) are enforced by scripts/validate-targets.mjs.",
  "type": "object",
  "required": ["services"],
  "properties": {
    "$schema": { "type": "string" },
    "description": { "type": "string" },
    "meta": {
      "type": "object",
      "properties": {
        "vendors": {
          "type": "object",
          "additionalProperties": {
            "type": "object",
            "required": ["name"],
            "properties": {
              "name": { "type": "string", "minLength": 1 },
              "url": { "type": "string", "pattern": "^https://" }
            }
          }
        }
      }
    },
    "platforms": {
      "type": "array",
      "items": {
        "type": "object",
        "required": ["id", "name", "vendor", "resultsPath", "probesFile"],
        "properties": {
          "id": { "type": "string", "pattern": "^[a-z0-9]+(?:-[a-z0-9]+)*$" },
          "name": { "type": "string", "minLength": 1 },
          "vendor": { "type": "string", "minLength": 1 },
          "resultsPath": { "type": "string", "pattern": "^/results/" },
          "probesFile": { "type": "string", "minLength": 1 }
        }
      }
    },
    "services": {
      "type": "array",
      "items": {
        "type": "object",
        "required": ["id", "name", "category", "domain", "url", "vendor"],
        "properties": {
          "id": { "type": "string", "pattern": "^[a-z0-9]+(?:-[a-z0-9]+)*$" },
          "name": { "type": "string", "minLength": 1 },
          "category": { "enum": ["fonts", "auth", "analytics", "embeds", "payments"] },
          "categories": { "type": "array", "minItems": 1, "items": { "enum": ["fonts", "auth", "analytics", "embeds", "payments"] } },
          "vendor": { "type": "string", "minLength": 1 },
          "tier": { "enum": ["curated", "community"] },
          "domain": { "type": "string", "minLength": 1 },
          "url": { "type": "string", "pattern": "^https://" },
          "demoPath": { "type": "string" },
          "symptom": { "type": "string" },
          "submittedBy": { "type": "string", "minLength": 1 },
          "addedAt": { "type": "string", "pattern": "^\\d{4}-\\d{2}-\\d{2}$" }
        }
      }
    }
  }
}
