{
  "$schema": "./targets.schema.json",
  "description": "Canonical list of third-party dependencies probed from mainland China. One object per dependency. Curated tier: each service has a single-dependency demo page. meta.vendors and platforms live here; community-submitted targets live in targets-community.json.",
  "meta": {
    "vendors": {
      "google": { "name": "Google", "url": "https://www.google.com" },
      "adobe": { "name": "Adobe", "url": "https://www.adobe.com" },
      "auth0": { "name": "Auth0", "url": "https://auth0.com" },
      "vimeo": { "name": "Vimeo", "url": "https://vimeo.com" },
      "netlify": { "name": "Netlify", "url": "https://www.netlify.com" },
      "vercel": { "name": "Vercel", "url": "https://vercel.com" }
    }
  },
  "platforms": [
    { "id": "firebase", "name": "Firebase", "vendor": "google", "resultsPath": "/results/firebase.html", "probesFile": "firebase-latest.json" },
    { "id": "netlify", "name": "Netlify", "vendor": "netlify", "resultsPath": "/results/netlify.html", "probesFile": "netlify-latest.json" },
    { "id": "vercel", "name": "Vercel", "vendor": "vercel", "resultsPath": "/results/vercel.html", "probesFile": "vercel-latest.json" }
  ],
  "services": [
    {
      "id": "google-fonts",
      "name": "Google Fonts",
      "category": "fonts",
      "categories": ["fonts"],
      "vendor": "google",
      "tier": "curated",
      "domain": "fonts.googleapis.com",
      "url": "https://fonts.googleapis.com/css2?family=Inter:wght@400;700&display=swap",
      "demoPath": "/demos/fonts-google.html",
      "symptom": "Fallback typeface and layout shift while the page waits for fonts that never arrive."
    },
    {
      "id": "material-symbols",
      "name": "Material Symbols",
      "category": "fonts",
      "categories": ["fonts"],
      "vendor": "google",
      "tier": "curated",
      "domain": "fonts.googleapis.com",
      "url": "https://fonts.googleapis.com/css2?family=Material+Symbols+Outlined",
      "demoPath": "/demos/icons-material.html",
      "symptom": "Icon glyphs render as empty boxes or raw ligature text when the icon font never loads."
    },
    {
      "id": "adobe-typekit",
      "name": "Adobe Fonts (Typekit)",
      "category": "fonts",
      "categories": ["fonts"],
      "vendor": "adobe",
      "tier": "curated",
      "domain": "use.typekit.net",
      "url": "https://use.typekit.net/abcdefg.css",
      "demoPath": "/demos/fonts-typekit.html",
      "symptom": "Text falls back to system fonts; branded type and weights never apply."
    },
    {
      "id": "recaptcha",
      "name": "Google reCAPTCHA",
      "category": "auth",
      "categories": ["auth"],
      "vendor": "google",
      "tier": "curated",
      "domain": "www.google.com",
      "url": "https://www.google.com/recaptcha/api.js",
      "demoPath": "/demos/recaptcha.html",
      "symptom": "The CAPTCHA widget never renders, so forms and sign-up cannot be submitted."
    },
    {
      "id": "auth0",
      "name": "Auth0",
      "category": "auth",
      "categories": ["auth"],
      "vendor": "auth0",
      "tier": "curated",
      "domain": "cdn.auth0.com",
      "url": "https://cdn.auth0.com/js/lock/11.34/lock.min.js",
      "demoPath": "/demos/auth0-lock.html",
      "symptom": "The login widget stalls or loads slowly, delaying or blocking sign-in."
    },
    {
      "id": "google-signin",
      "name": "Google Sign-In",
      "category": "auth",
      "categories": ["auth"],
      "vendor": "google",
      "tier": "curated",
      "domain": "accounts.google.com",
      "url": "https://accounts.google.com/gsi/client",
      "demoPath": "/demos/google-signin.html",
      "symptom": "The Google sign-in button never appears, locking out that login path."
    },
    {
      "id": "gtm",
      "name": "Google Tag Manager",
      "category": "analytics",
      "categories": ["analytics"],
      "vendor": "google",
      "tier": "curated",
      "domain": "www.googletagmanager.com",
      "url": "https://www.googletagmanager.com/gtm.js?id=GTM-MR8ZL58Z",
      "demoPath": "/demos/gtm.html",
      "symptom": "Tag Manager fails to load, so downstream tags and events never fire."
    },
    {
      "id": "ga4",
      "name": "Google Analytics 4",
      "category": "analytics",
      "categories": ["analytics"],
      "vendor": "google",
      "tier": "curated",
      "domain": "www.googletagmanager.com",
      "url": "https://www.googletagmanager.com/gtag/js?id=G-P6BVQ3VWTC",
      "demoPath": "/demos/ga4.html",
      "symptom": "Analytics never initializes; pageviews and events go uncollected."
    },
    {
      "id": "youtube",
      "name": "YouTube embed",
      "category": "embeds",
      "categories": ["embeds"],
      "vendor": "google",
      "tier": "curated",
      "domain": "www.youtube.com",
      "url": "https://www.youtube.com/embed/aqz-KE-bpKQ",
      "demoPath": "/demos/youtube-embed.html",
      "symptom": "The video area stays blank/black — player chrome and thumbnail never load."
    },
    {
      "id": "google-maps",
      "name": "Google Maps",
      "category": "embeds",
      "categories": ["embeds"],
      "vendor": "google",
      "tier": "curated",
      "domain": "maps.googleapis.com",
      "url": "https://maps.googleapis.com/maps/api/js?key=YOUR_GOOGLE_MAPS_API_KEY",
      "demoPath": "/demos/google-maps.html",
      "symptom": "The map collapses into an empty grey box with no tiles or controls."
    },
    {
      "id": "vimeo",
      "name": "Vimeo embed",
      "category": "embeds",
      "categories": ["embeds"],
      "vendor": "vimeo",
      "tier": "curated",
      "domain": "player.vimeo.com",
      "url": "https://player.vimeo.com/video/76979871",
      "demoPath": "/demos/vimeo-embed.html",
      "symptom": "The Vimeo player stays blank — the embed iframe never finishes loading."
    }
  ]
}
